{
  "title": "Duplicate tour order",
  "nodes": [
    {
      "id": "a",
      "label": "A",
      "kind": "service"
    },
    {
      "id": "b",
      "label": "B",
      "kind": "service"
    }
  ],
  "edges": [
    {
      "from": "a",
      "to": "b",
      "type": "solid",
      "condition": null
    }
  ],
  "tour": [
    {
      "order": 1,
      "title": "T1",
      "description": "D1",
      "nodeIds": [
        "a"
      ]
    },
    {
      "order": 1,
      "title": "T2",
      "description": "D2",
      "nodeIds": [
        "b"
      ]
    }
  ]
}
