{
  "title": "Too many tour entries",
  "nodes": [
    {
      "id": "a",
      "label": "A",
      "kind": "service"
    }
  ],
  "edges": [],
  "tour": [
    {
      "order": 1,
      "title": "Step 0",
      "description": "D",
      "nodeIds": [
        "a"
      ]
    },
    {
      "order": 2,
      "title": "Step 1",
      "description": "D",
      "nodeIds": [
        "a"
      ]
    },
    {
      "order": 3,
      "title": "Step 2",
      "description": "D",
      "nodeIds": [
        "a"
      ]
    },
    {
      "order": 4,
      "title": "Step 3",
      "description": "D",
      "nodeIds": [
        "a"
      ]
    },
    {
      "order": 5,
      "title": "Step 4",
      "description": "D",
      "nodeIds": [
        "a"
      ]
    },
    {
      "order": 6,
      "title": "Step 5",
      "description": "D",
      "nodeIds": [
        "a"
      ]
    },
    {
      "order": 7,
      "title": "Step 6",
      "description": "D",
      "nodeIds": [
        "a"
      ]
    },
    {
      "order": 8,
      "title": "Step 7",
      "description": "D",
      "nodeIds": [
        "a"
      ]
    },
    {
      "order": 9,
      "title": "Step 8",
      "description": "D",
      "nodeIds": [
        "a"
      ]
    },
    {
      "order": 10,
      "title": "Step 9",
      "description": "D",
      "nodeIds": [
        "a"
      ]
    },
    {
      "order": 11,
      "title": "Step 10",
      "description": "D",
      "nodeIds": [
        "a"
      ]
    },
    {
      "order": 12,
      "title": "Step 11",
      "description": "D",
      "nodeIds": [
        "a"
      ]
    },
    {
      "order": 13,
      "title": "Step 12",
      "description": "D",
      "nodeIds": [
        "a"
      ]
    },
    {
      "order": 14,
      "title": "Step 13",
      "description": "D",
      "nodeIds": [
        "a"
      ]
    },
    {
      "order": 15,
      "title": "Step 14",
      "description": "D",
      "nodeIds": [
        "a"
      ]
    },
    {
      "order": 16,
      "title": "Step 15",
      "description": "D",
      "nodeIds": [
        "a"
      ]
    },
    {
      "order": 17,
      "title": "Step 16",
      "description": "D",
      "nodeIds": [
        "a"
      ]
    },
    {
      "order": 18,
      "title": "Step 17",
      "description": "D",
      "nodeIds": [
        "a"
      ]
    },
    {
      "order": 19,
      "title": "Step 18",
      "description": "D",
      "nodeIds": [
        "a"
      ]
    },
    {
      "order": 20,
      "title": "Step 19",
      "description": "D",
      "nodeIds": [
        "a"
      ]
    },
    {
      "order": 21,
      "title": "Step 20",
      "description": "D",
      "nodeIds": [
        "a"
      ]
    },
    {
      "order": 22,
      "title": "Step 21",
      "description": "D",
      "nodeIds": [
        "a"
      ]
    },
    {
      "order": 23,
      "title": "Step 22",
      "description": "D",
      "nodeIds": [
        "a"
      ]
    },
    {
      "order": 24,
      "title": "Step 23",
      "description": "D",
      "nodeIds": [
        "a"
      ]
    },
    {
      "order": 25,
      "title": "Step 24",
      "description": "D",
      "nodeIds": [
        "a"
      ]
    },
    {
      "order": 26,
      "title": "Step 25",
      "description": "D",
      "nodeIds": [
        "a"
      ]
    },
    {
      "order": 27,
      "title": "Step 26",
      "description": "D",
      "nodeIds": [
        "a"
      ]
    },
    {
      "order": 28,
      "title": "Step 27",
      "description": "D",
      "nodeIds": [
        "a"
      ]
    },
    {
      "order": 29,
      "title": "Step 28",
      "description": "D",
      "nodeIds": [
        "a"
      ]
    },
    {
      "order": 30,
      "title": "Step 29",
      "description": "D",
      "nodeIds": [
        "a"
      ]
    },
    {
      "order": 31,
      "title": "Step 30",
      "description": "D",
      "nodeIds": [
        "a"
      ]
    },
    {
      "order": 32,
      "title": "Step 31",
      "description": "D",
      "nodeIds": [
        "a"
      ]
    },
    {
      "order": 33,
      "title": "Step 32",
      "description": "D",
      "nodeIds": [
        "a"
      ]
    },
    {
      "order": 34,
      "title": "Step 33",
      "description": "D",
      "nodeIds": [
        "a"
      ]
    },
    {
      "order": 35,
      "title": "Step 34",
      "description": "D",
      "nodeIds": [
        "a"
      ]
    },
    {
      "order": 36,
      "title": "Step 35",
      "description": "D",
      "nodeIds": [
        "a"
      ]
    },
    {
      "order": 37,
      "title": "Step 36",
      "description": "D",
      "nodeIds": [
        "a"
      ]
    },
    {
      "order": 38,
      "title": "Step 37",
      "description": "D",
      "nodeIds": [
        "a"
      ]
    },
    {
      "order": 39,
      "title": "Step 38",
      "description": "D",
      "nodeIds": [
        "a"
      ]
    },
    {
      "order": 40,
      "title": "Step 39",
      "description": "D",
      "nodeIds": [
        "a"
      ]
    },
    {
      "order": 41,
      "title": "Step 40",
      "description": "D",
      "nodeIds": [
        "a"
      ]
    },
    {
      "order": 42,
      "title": "Step 41",
      "description": "D",
      "nodeIds": [
        "a"
      ]
    },
    {
      "order": 43,
      "title": "Step 42",
      "description": "D",
      "nodeIds": [
        "a"
      ]
    },
    {
      "order": 44,
      "title": "Step 43",
      "description": "D",
      "nodeIds": [
        "a"
      ]
    },
    {
      "order": 45,
      "title": "Step 44",
      "description": "D",
      "nodeIds": [
        "a"
      ]
    },
    {
      "order": 46,
      "title": "Step 45",
      "description": "D",
      "nodeIds": [
        "a"
      ]
    },
    {
      "order": 47,
      "title": "Step 46",
      "description": "D",
      "nodeIds": [
        "a"
      ]
    },
    {
      "order": 48,
      "title": "Step 47",
      "description": "D",
      "nodeIds": [
        "a"
      ]
    },
    {
      "order": 49,
      "title": "Step 48",
      "description": "D",
      "nodeIds": [
        "a"
      ]
    },
    {
      "order": 50,
      "title": "Step 49",
      "description": "D",
      "nodeIds": [
        "a"
      ]
    },
    {
      "order": 51,
      "title": "Step 50",
      "description": "D",
      "nodeIds": [
        "a"
      ]
    }
  ]
}
